[
  {"id":"npc_wang_shushu","稱呼":"王叔叔","性格":["吝嗇","面子薄"],"避雷":["被嘲笑"],"轉折階段":["抗拒","猶豫","願試","承諾"],"可被說動的點":["給他體面的方法"],"到場條件":["點燈"]},
  {"id":"npc_liang_uncle","稱呼":"梁叔","性格":["固執","嘴硬"],"避雷":["提起舊怨"],"轉折階段":["推託","盤算","決意"],"可被說動的點":["保住家族名聲"],"到場條件":["保證不公開"]},
  {"id":"npc_fisher_head","稱呼":"漁會頭人","性格":["務實","講義氣"],"避雷":["浪費香火"],"轉折階段":["旁觀","傾聽","行動"],"可被說動的點":["漁民平安返港"],"到場條件":["重修祭壇"]}
]
